{
  "fixture_notice": "ALL VALUES BELOW ARE SYNTHETIC CALIBRATION CONTRACT TEST DATA. Outcomes are not observations about the real labour market.",
  "schema_version": "0.1.0",
  "benchmark_id": "SA-WORKFORCE-CALIBRATION-001",
  "synthetic_only": true,
  "claim_ceiling": "synthetic_contract_only",
  "event_definition": "independently_confirmed_task_scoped_capacity_gap_within_horizon",
  "forecast_horizon_days": 30,
  "decision_threshold": 0.5,
  "minimum_coverage": 0.75,
  "probability_bin_width": 0.2,
  "model_catalog": [
    {
      "model_id": "constant_prevalence",
      "role": "baseline",
      "description": "Constant 0.5 prevalence baseline; tie at threshold counts as positive."
    },
    {
      "model_id": "transparent_rules",
      "role": "candidate",
      "description": "Transparent task-scoped rules; synthetic predictions for score verification."
    },
    {
      "model_id": "overconfident_control",
      "role": "negative_control",
      "description": "Deliberately overconfident control with two severely wrong forecasts."
    },
    {
      "model_id": "abstaining_rules",
      "role": "candidate",
      "description": "Transparent rules that abstain on three ambiguous cases."
    },
    {
      "model_id": "all_abstain_control",
      "role": "negative_control",
      "description": "Negative control that abstains on every case and must fail minimum coverage."
    }
  ],
  "cases": [
    {
      "case_id": "CAL-001",
      "task_scope_id": "TASK-SYN-WATER-01",
      "prediction_cutoff": "2026-01-01",
      "outcome_observed": 1,
      "forecasts": [
        {
          "model_id": "constant_prevalence",
          "status": "issued",
          "probability": 0.5,
          "abstention_reason": null
        },
        {
          "model_id": "transparent_rules",
          "status": "issued",
          "probability": 0.72,
          "abstention_reason": null
        },
        {
          "model_id": "overconfident_control",
          "status": "issued",
          "probability": 0.95,
          "abstention_reason": null
        },
        {
          "model_id": "abstaining_rules",
          "status": "issued",
          "probability": 0.72,
          "abstention_reason": null
        },
        {
          "model_id": "all_abstain_control",
          "status": "abstained",
          "probability": null,
          "abstention_reason": "negative_control_all_abstain"
        }
      ]
    },
    {
      "case_id": "CAL-002",
      "task_scope_id": "TASK-SYN-POWER-02",
      "prediction_cutoff": "2026-01-01",
      "outcome_observed": 0,
      "forecasts": [
        {
          "model_id": "constant_prevalence",
          "status": "issued",
          "probability": 0.5,
          "abstention_reason": null
        },
        {
          "model_id": "transparent_rules",
          "status": "issued",
          "probability": 0.28,
          "abstention_reason": null
        },
        {
          "model_id": "overconfident_control",
          "status": "issued",
          "probability": 0.05,
          "abstention_reason": null
        },
        {
          "model_id": "abstaining_rules",
          "status": "issued",
          "probability": 0.28,
          "abstention_reason": null
        },
        {
          "model_id": "all_abstain_control",
          "status": "abstained",
          "probability": null,
          "abstention_reason": "negative_control_all_abstain"
        }
      ]
    },
    {
      "case_id": "CAL-003",
      "task_scope_id": "TASK-SYN-CYBER-03",
      "prediction_cutoff": "2026-01-01",
      "outcome_observed": 1,
      "forecasts": [
        {
          "model_id": "constant_prevalence",
          "status": "issued",
          "probability": 0.5,
          "abstention_reason": null
        },
        {
          "model_id": "transparent_rules",
          "status": "issued",
          "probability": 0.67,
          "abstention_reason": null
        },
        {
          "model_id": "overconfident_control",
          "status": "issued",
          "probability": 0.92,
          "abstention_reason": null
        },
        {
          "model_id": "abstaining_rules",
          "status": "issued",
          "probability": 0.67,
          "abstention_reason": null
        },
        {
          "model_id": "all_abstain_control",
          "status": "abstained",
          "probability": null,
          "abstention_reason": "negative_control_all_abstain"
        }
      ]
    },
    {
      "case_id": "CAL-004",
      "task_scope_id": "TASK-SYN-REPAIR-01",
      "prediction_cutoff": "2026-01-01",
      "outcome_observed": 0,
      "forecasts": [
        {
          "model_id": "constant_prevalence",
          "status": "issued",
          "probability": 0.5,
          "abstention_reason": null
        },
        {
          "model_id": "transparent_rules",
          "status": "issued",
          "probability": 0.42,
          "abstention_reason": null
        },
        {
          "model_id": "overconfident_control",
          "status": "issued",
          "probability": 0.98,
          "abstention_reason": null
        },
        {
          "model_id": "abstaining_rules",
          "status": "abstained",
          "probability": null,
          "abstention_reason": "ambiguous_source_evidence"
        },
        {
          "model_id": "all_abstain_control",
          "status": "abstained",
          "probability": null,
          "abstention_reason": "negative_control_all_abstain"
        }
      ]
    },
    {
      "case_id": "CAL-005",
      "task_scope_id": "TASK-SYN-WATER-02",
      "prediction_cutoff": "2026-01-01",
      "outcome_observed": 0,
      "forecasts": [
        {
          "model_id": "constant_prevalence",
          "status": "issued",
          "probability": 0.5,
          "abstention_reason": null
        },
        {
          "model_id": "transparent_rules",
          "status": "issued",
          "probability": 0.3,
          "abstention_reason": null
        },
        {
          "model_id": "overconfident_control",
          "status": "issued",
          "probability": 0.04,
          "abstention_reason": null
        },
        {
          "model_id": "abstaining_rules",
          "status": "issued",
          "probability": 0.3,
          "abstention_reason": null
        },
        {
          "model_id": "all_abstain_control",
          "status": "abstained",
          "probability": null,
          "abstention_reason": "negative_control_all_abstain"
        }
      ]
    },
    {
      "case_id": "CAL-006",
      "task_scope_id": "TASK-SYN-POWER-03",
      "prediction_cutoff": "2026-01-01",
      "outcome_observed": 1,
      "forecasts": [
        {
          "model_id": "constant_prevalence",
          "status": "issued",
          "probability": 0.5,
          "abstention_reason": null
        },
        {
          "model_id": "transparent_rules",
          "status": "issued",
          "probability": 0.7,
          "abstention_reason": null
        },
        {
          "model_id": "overconfident_control",
          "status": "issued",
          "probability": 0.93,
          "abstention_reason": null
        },
        {
          "model_id": "abstaining_rules",
          "status": "issued",
          "probability": 0.7,
          "abstention_reason": null
        },
        {
          "model_id": "all_abstain_control",
          "status": "abstained",
          "probability": null,
          "abstention_reason": "negative_control_all_abstain"
        }
      ]
    },
    {
      "case_id": "CAL-007",
      "task_scope_id": "TASK-SYN-CYBER-01",
      "prediction_cutoff": "2026-01-01",
      "outcome_observed": 0,
      "forecasts": [
        {
          "model_id": "constant_prevalence",
          "status": "issued",
          "probability": 0.5,
          "abstention_reason": null
        },
        {
          "model_id": "transparent_rules",
          "status": "issued",
          "probability": 0.45,
          "abstention_reason": null
        },
        {
          "model_id": "overconfident_control",
          "status": "issued",
          "probability": 0.08,
          "abstention_reason": null
        },
        {
          "model_id": "abstaining_rules",
          "status": "abstained",
          "probability": null,
          "abstention_reason": "ambiguous_source_evidence"
        },
        {
          "model_id": "all_abstain_control",
          "status": "abstained",
          "probability": null,
          "abstention_reason": "negative_control_all_abstain"
        }
      ]
    },
    {
      "case_id": "CAL-008",
      "task_scope_id": "TASK-SYN-REPAIR-02",
      "prediction_cutoff": "2026-01-01",
      "outcome_observed": 1,
      "forecasts": [
        {
          "model_id": "constant_prevalence",
          "status": "issued",
          "probability": 0.5,
          "abstention_reason": null
        },
        {
          "model_id": "transparent_rules",
          "status": "issued",
          "probability": 0.58,
          "abstention_reason": null
        },
        {
          "model_id": "overconfident_control",
          "status": "issued",
          "probability": 0.03,
          "abstention_reason": null
        },
        {
          "model_id": "abstaining_rules",
          "status": "abstained",
          "probability": null,
          "abstention_reason": "ambiguous_source_evidence"
        },
        {
          "model_id": "all_abstain_control",
          "status": "abstained",
          "probability": null,
          "abstention_reason": "negative_control_all_abstain"
        }
      ]
    },
    {
      "case_id": "CAL-009",
      "task_scope_id": "TASK-SYN-WATER-03",
      "prediction_cutoff": "2026-01-01",
      "outcome_observed": 0,
      "forecasts": [
        {
          "model_id": "constant_prevalence",
          "status": "issued",
          "probability": 0.5,